{"audit_head_hash":"0000000000000000000000000000000000000000000000000000000000000000","combined_h2":0.3809465857053901,"config_vector":{"h1_subset_size":32,"h2_bins":16,"h2_max":4.0,"h2_min":0.0},"config_vector_hash":"8b933646954da538da396b2612a9026585b8efc5e28ed64ce312b9c284a7c2ac","epw_hash":"421c98020e1bc25a79e904a7a83e8c4b2d14aea5a118428fc19c2030d656f793","h1_subset":[0.40784313725490196,0.3803921568627451,0.45098039215686275,0.40784313725490196,0.396078431372549,0.43137254901960786,0.37254901960784315,0.396078431372549,0.47058823529411764,0.3803921568627451,0.42745098039215684,0.4392156862745098,0.4235294117647059,0.396078431372549,0.37254901960784315,0.3803921568627451,0.4470588235294118,0.4549019607843137,0.4117647058823529,0.4,0.3803921568627451,0.38823529411764707,0.4549019607843137,0.37254901960784315,0.4627450980392157,0.19215686274509805,0.0392156862745098],"issued_at":"2026-03-06T03:22:44.052171Z","per_modality_h2":[0.3809465857053901],"resonance":0.085773752198037,"routing_path":[],"sandbox_metadata":null,"schema_version":"hashen.seal.v1"}