{"audit_head_hash":"e3da8739e01c40fef1ceb772c3dab33fcd0ce6037bc456521cde3903879af669","combined_h2":0.3809465857053901,"config_vector":{"fixed_range_policy":"preconfigured_no_autorange","h1_subset_size":32,"h2_bins":16,"h2_max":4.0,"h2_min":0.0,"policy_version":"hashen.policy.v1"},"config_vector_hash":"ed698ec16d1bbef755b0bc2982a7a7f425cccf03ebf3a3b6d373cebcfecc1ecc","epw_hash":"7202dfdae25fa6082a98a592286fad404f48802ed334a06710478f12029aef5d","h1_subset":[0.40784313725490196,0.3803921568627451,0.45098039215686275,0.40784313725490196,0.396078431372549,0.43137254901960786,0.37254901960784315,0.396078431372549,0.47058823529411764,0.3803921568627451,0.42745098039215684,0.4392156862745098,0.4235294117647059,0.396078431372549,0.37254901960784315,0.3803921568627451,0.4470588235294118,0.4549019607843137,0.4117647058823529,0.4,0.3803921568627451,0.38823529411764707,0.4549019607843137,0.37254901960784315,0.4627450980392157,0.19215686274509805,0.0392156862745098],"issued_at":"2026-03-06T04:07:02.361950Z","per_modality_h2":[0.3809465857053901],"resonance":0.085773752198037,"routing_path":[],"sandbox_metadata":null,"schema_version":"hashen.seal.v1"}